{
  "$schema": "http://json-schema.org/draft-07/schema#",
  "$id": "vc.cloudInstance",
  "title": "Cloud Instance Verifiable Credential",
  "description": "Schema for verifying which cloud instances a BMS should send its battery data to.",
  "type": "object",
  "required": ["@context", "id", "type", "issuer", "holder", "issuanceDate", "expirationDate", "credentialSubject", "proof"],
  "additionalProperties": false,
  "properties": {
    "@context": {
      "type": "array",
      "items": {
        "type": "string",
        "format": "uri",
        "enum": [
          "https://www.w3.org/2018/credentials/v1",
          "http://localhost:8443/docs/vc.cloudInstance.schema.html"
        ]
      },
      "minItems": 2,
      "maxItems": 2,
      "uniqueItems": true,
      "description": "Defines the JSON-LD context, providing meaning to terms used in the credential."
    },
    "id": { "type": "string", "format": "uri" },
    "type": {
      "type": "array",
      "items": {
        "type": "string"
      },
      "prefixItems": [
        { "const": "VerifiableCredential" },
        { "const": "CloudInstance" }
      ],
      "uniqueItems": true,
      "minItems": 2,
      "maxItems": 2
    },
    "issuer": { "$ref": "common.defs.schema.json#/definitions/DIDOEM" },
    "holder": { "$ref": "common.defs.schema.json#/definitions/DIDBMS" },
    "issuanceDate": { "$ref": "common.defs.schema.json#/definitions/DateTime" },
    "expirationDate": { "$ref": "common.defs.schema.json#/definitions/DateTime" },
    "credentialSubject": {
      "type": "object",
      "required": ["id", "type", "cloudDid", "timestamp"],
      "additionalProperties": false,
      "properties": {
        "id": { "$ref": "common.defs.schema.json#/definitions/URI" },
        "type": {
          "type": "string",
          "const": "CloudInstance"
        },
        "cloudDid": { "$ref": "common.defs.schema.json#/definitions/DIDCLOUD" },
        "timestamp": { "$ref": "common.defs.schema.json#/definitions/DateTime" }
      }
    },
    "proof": { "$ref": "common.defs.schema.json#/definitions/Proof" }
  }
}
