{
  "@context": [
    "https://www.w3.org/2018/credentials/v1",
    "http://localhost:8443/docs/vc.cloudInstance.schema.html"
  ],
  "id": "urn:uuid:cc4e69d7-b7f7-4155-ac8b-5af63df4472a",
  "type": [
    "VerifiableCredential",
    "CloudInstance"
  ],
  "issuer": "did:batterypass:oem.xyz",
  "holder": "did:batterypass:bms.identifier",
  "issuanceDate": "2025-07-04T07:45:00Z",
  "expirationDate": "2027-07-04T07:45:00Z",
  "credentialSubject": {
    "id": "did:batterypass:bms.identifier",
    "type": "CloudInstance",
    "cloudDid": "did:batterypass:cloud.prod-eu-west",
    "timestamp": "2025-07-04T07:45:05Z"
  },
  "proof": {
    "type": "EcdsaSecp256r1Signature2019",
    "created": "2025-07-04T07:45:05Z",
    "verificationMethod": "did:batterypass:oem.xyz#key-1",
    "proofPurpose": "authentication",
    "jws": "eyJhbGciOiJFUzI1NiJ9..BASE64_SIG"
  }
}